,Unnamed: 0,acronym,summary,tags,has_tags,semantic_type,classification_data
313,313,OECD,"The OECD Better Life Index, created in May 2011 by the Organisation for Economic Co-operation and Development, is an initiative pioneering the development of economic indicators which better capture multiple dimensions of economic and social progress. 
The platform consists of a dashboard, that provides data and insights into key indicators - measuring areas such as wellbeing, environmental quality, quality of public services and security - alongside an interactive tool Your Better Life Index (BLI), which encourages citizens to create their own indexes by ranking each of the indicators according to the importance in their own lives.
The index and tool were created as part of the OECD Better Life Initiative. This initiative began in 2011 in line with the recommendations of the Commission on the Measurement of Economic Performance and Social Progress, also known as the Stiglitz-Sen-Fitoussi Commission, whose recommendations sought to address concerns that standard macroeconomic statistics like GDP failed to give a true account of people's current and future well-being. The initiative's goals are to develop social and wellbeing indicators that can better reflect growth focusing on four key areas; environmental sustainability, increased wellbeing, falling inequality and systems resilience. The 'beyond growth' approach to economic progress is relatively new and the OECD Better Life Initiative promotes the co-production of what we might standardise by facilitating conversation between the public and policymakers.
You can create your own economic index by ranking 11 areas of socio-economic progress by what is important to you, this generates a ranking so you can see how your country compares. You are encouraged to share your indicator with others on the platform to view theirs and discuss your similarities and differences. You can choose to share their data with OECD and will then be asked to provide more demographical data about your situation. The OECD Better Life Initiative then analyses all users input data and reports the findings in a bi-annual report named How's Life? Well-being. The data used in the report consists of 80+ indicators including measures on inequality and further socio-economic indicators. The findings reflect what is important to citizens, and how their current socio-economic situations reflect in the areas of governance that they prioritise. These insights are then used to guide governments to put well-being at the centre of their policymaking by shedding light on what well-being means to their citizens.  In this way, by using the tool citizens can shape public policy.","[{'match': 'standard', 'norm': 'standard', 'case': 'lower', 'exact': True, 'start': 968, 'end': 976}]",True,Non-Financial Entity,"{'policy': 0.9271135926246643, 'guideline': 0.8940151929855347, 'regulatory body': 0.39561954140663147, 'bank': 0.3949338495731354, 'finance': 0.39033979177474976}"
327,327,DFI,"DfI Rivers is an Executive Agency of the Department for Infrastructure (DfI), in the Northern Ireland Executive. It is the statutory drainage and flood defence authority for Northern Ireland under the terms of the Drainage (Northern Ireland) Order 1973.DfI is the competent authority for the implementation of the EU Floods directive and has delegated the day to day delivery of the directive to DfI Rivers.
The DfI Rivers Headquarters is located in Cookstown and it has Regional headquarters in Lisburn and Omagh and offices in Coleraine, Craigavon and Ballinamallard.The Strategic Flood Map (NI)  - Rivers & Sea was developed by the DfI Rivers in co-operation with the-then Department of the Environment (DOE). The primary aim of the Strategic Flood Map is to provide an illustration of the areas throughout Northern Ireland that are considered to be at risk of flooding from rivers and the sea. In December 2011 a new version of the map was released that refreshed the information on rivers and the sea, updated the historical information to include the latest flood events and for the first time it included a surface water flood layer.The Map is designed to:

Help DfI Rivers and others to plan and manage the work to reduce flood risk.
To encourage people living and working in areas prone to flooding to find out more and take appropriate action.
Inform anyone who wants to apply for planning permission if flooding is likely to be an important consideration.","[{'match': 'directive', 'norm': 'directive', 'case': 'lower', 'exact': True, 'start': 324, 'end': 333}, {'match': 'directive', 'norm': 'directive', 'case': 'lower', 'exact': True, 'start': 383, 'end': 392}]",True,Non-Financial Entity,"{'regulatory body': 0.5884680151939392, 'bank': 0.4799416959285736, 'finance': 0.22758623957633972, 'policy': 0.21849578619003296, 'guideline': 0.1306712031364441}"
346,346,SEF,"A Swap Execution Facility (SEF) (sometimes Swaps Execution Facility) is a platform for financial swap trading that provides pre-trade information (i.e. bid and offer prices) and a mechanism for executing swap transactions among eligible participants.Swap Execution Facilities are regulated by the Securities and Exchange Commission and the Commodity Futures Trading Commission.  The regulated trading of certain swaps is a result of requirements in the United States by the Dodd–Frank Wall Street Reform and Consumer Protection Act (in particular Title VII). Financial swaps have traditionally been traded in over-the-counter (OTC) markets. However, regulatory changes have driven reporting, clearing, and settlement functions to SEFs, which are much more tightly regulated. The SEF-execution mandate responds to one of the four derivatives-related European Union, have proposed similar changes in swap market structure but none have yet been adopted.As of October 2, 2013, any swap listed by a SEF may be traded by the parties on the SEF, but may also be traded off-SEF in any other lawful manner. The swaps that must be traded on SEFs are both subject to a CFTC-centralized clearing mandate and have been determined to be ""made available to trade"" (MAT) by at least one SEF. Four categories of interest rate swaps and two categories of credit default swaps are currently subject to clearing mandates.","[{'match': 'financial', 'norm': 'financial', 'case': 'lower', 'exact': True, 'start': 87, 'end': 96}]",True,regulatory body,"{'regulatory body': 0.963674783706665, 'policy': 0.44834885001182556, 'bank': 0.41035446524620056, 'guideline': 0.28941410779953003}"
363,363,CFPB,"The Consumer Financial Protection Bureau (CFPB) is an agency of the United States government responsible for consumer protection in the financial sector. CFPB's jurisdiction includes banks, credit unions, securities firms, payday lenders, mortgage-servicing operations, foreclosure relief services, debt collectors, and other financial companies operating in the United States. Since its founding, the CFPB has used technology tools to monitor how financial entities used social media and algorithms to target consumers.: 531–532, 537 
The CFPB's creation was authorized by the Dodd–Frank Wall Street Reform and Consumer Protection Act, whose passage in 2010 was a legislative response to the financial crisis of 2007–08 and the subsequent Great Recession. The CFPB's status as an independent agency has been subject to many challenges in court. In June 2020, the United States Supreme Court found the single-director structure removable only with-cause unconstitutional but allowed the agency to remain in operation.","[{'match': 'financial', 'norm': 'financial', 'case': 'lower', 'exact': True, 'start': 136, 'end': 145}, {'match': 'securities', 'norm': 'securities', 'case': 'lower', 'exact': True, 'start': 205, 'end': 215}, {'match': 'financial', 'norm': 'financial', 'case': 'lower', 'exact': True, 'start': 326, 'end': 335}, {'match': 'financial', 'norm': 'financial', 'case': 'lower', 'exact': True, 'start': 448, 'end': 457}, {'match': 'financial', 'norm': 'financial', 'case': 'lower', 'exact': True, 'start': 693, 'end': 702}]",True,regulatory body,"{'regulatory body': 0.9724807143211365, 'bank': 0.5794382095336914, 'policy': 0.531158447265625, 'guideline': 0.49253299832344055}"
364,364,AIFM,"Directive 2011/61/EU is a legal act of the European Union on the financial regulation of hedge funds, private equity, real estate funds, and other ""Alternative Investment Fund Managers"" (AIFMs) in the European Union. The Directive requires all covered AIFMs to obtain authorisation, and make various disclosures as a condition of operation. It followed the global financial crisis. Before, the alternative investment industry had not been regulated at EU level.It was reported in May 2014 that only one-third of EU member states had successfully implemented the directive into law. As of 2014, the countries that had transposed Directive 2011/61/EU into law include Cyprus, the Czech Republic, the United Kingdom, Luxembourg, (Germany), France, Malta and Ireland. In December 2014, the European Commission issued a formal warning to countries including Spain, Latvia and Poland for not complying with implementation of Directive 2011/61/EU.

","[{'match': 'financial', 'norm': 'financial', 'case': 'lower', 'exact': True, 'start': 65, 'end': 74}, {'match': 'financial', 'norm': 'financial', 'case': 'lower', 'exact': True, 'start': 364, 'end': 373}, {'match': 'directive', 'norm': 'directive', 'case': 'lower', 'exact': True, 'start': 562, 'end': 571}]",True,regulatory body,"{'regulatory body': 0.8400179147720337, 'policy': 0.67659991979599, 'guideline': 0.538702666759491, 'bank': 0.2219940572977066}"
367,367,PSD,"Adobe Photoshop is a raster graphics editor developed and published by Adobe Inc. for Windows and macOS. It was originally created in 1988 by Thomas and John Knoll. Since then, the software has become the industry standard not only in raster graphics editing, but in digital art as a whole. The software's name is often colloquially used as a verb (e.g. ""to photoshop an image"", ""photoshopping"", and ""photoshop contest"") although Adobe discourages such use. Photoshop can edit and compose raster images in multiple layers and supports masks, alpha compositing and several color models including RGB, CMYK, CIELAB, spot color, and duotone. Photoshop uses its own PSD and PSB file formats to support these features. In addition to raster graphics, Photoshop has limited abilities to edit or render text and vector graphics (especially through clipping path for the latter), as well as 3D graphics and video. Its feature set can be expanded by plug-ins; programs developed and distributed independently of Photoshop that run inside it and offer new or enhanced features.
Photoshop's naming scheme was initially based on version numbers. However, in October 2002 (following the introduction of Creative Suite branding), each new version of Photoshop was designated with ""CS"" plus a number; e.g., the eighth major version of Photoshop was Photoshop CS and the ninth was Photoshop CS2. Photoshop CS3 through CS6 were also distributed in two different editions: Standard and Extended. With the introduction of the Creative Cloud branding in June 2013 (and in turn, the change of the ""CS"" suffix to ""CC""), Photoshop's licensing scheme was changed to that of software as a service subscription model. Historically, Photoshop was bundled with additional software such as Adobe ImageReady, Adobe Fireworks, Adobe Bridge, Adobe Device Central and Adobe Camera RAW.
Alongside Photoshop, Adobe also develops and publishes Photoshop Elements, Photoshop Lightroom, Photoshop Express,  Photoshop Fix, Photoshop Sketch and Photoshop Mix. As of November 2019, Adobe has also released a full version of Photoshop for the iPad, and while initially limited, Adobe plans to bring more features to Photoshop for iPad. Collectively, they are branded as ""The Adobe Photoshop Family"".","[{'match': 'standard', 'norm': 'standard', 'case': 'lower', 'exact': True, 'start': 214, 'end': 222}]",True,Non-Financial Entity,"{'policy': 0.6177811026573181, 'guideline': 0.601787269115448, 'regulatory body': 0.49426132440567017, 'bank': 0.20491132140159607, 'finance': 0.1546442061662674}"
376,376,FHFA,"In September 2008 the Federal Housing Finance Agency (FHFA) announced that it would take over the Federal National Mortgage Association (Fannie Mae) and the Federal Home Loan Mortgage Corporation (Freddie Mac). Both government-sponsored enterprises, which finance home mortgages in the United States by issuing bonds, had become illiquid as the market for those bonds collapsed in the subprime mortgage crisis. The FHFA established conservatorships in which each enterprise's management works under the FHFA's direction to reduce losses and to develop a new operating structure that will allow a return to self-management.","[{'match': 'finance', 'norm': 'finance', 'case': 'lower', 'exact': True, 'start': 256, 'end': 263}]",True,regulatory body,"{'regulatory body': 0.9818997383117676, 'policy': 0.8403677940368652, 'guideline': 0.4148953855037689, 'bank': 0.1978452503681183}"
377,377,MLRO,The Proceeds of Crime Act 2002 (c.29) (POCA) is an Act of the Parliament of the United Kingdom which provides for the confiscation or civil recovery of the proceeds from crime and contains the principal money laundering legislation in the UK.,"[{'match': 'money', 'norm': 'money', 'case': 'lower', 'exact': True, 'start': 203, 'end': 208}]",True,Non-Financial Entity,"{'regulatory body': 0.44613906741142273, 'policy': 0.2926695644855499, 'finance': 0.21184495091438293, 'bank': 0.18001368641853333, 'guideline': 0.09631551802158356}"
378,378,IASB,"The International Accounting Standards Board (IASB) is the independent accounting standard-setting body of the IFRS Foundation.
The IASB was founded on April 1, 2001, as the successor to the International Accounting Standards Committee (IASC). It is responsible for developing International Financial Reporting Standards (IFRS) and for promoting their use and application.

","[{'match': 'standard', 'norm': 'standard', 'case': 'lower', 'exact': True, 'start': 82, 'end': 90}]",True,Other Financial Entity,"{'guideline': 0.4504348635673523, 'policy': 0.3882733881473541, 'bank': 0.35460713505744934, 'regulatory body': 0.2595030665397644}"
403,403,FTR,"The Indian FTR (formerly FTR 1200) is a standard motorcycle manufactured by Polaris Inc. under the Indian Motorcycle marque since 2019.The FTR1200 and its derivative, the FTR1200S, have been noted as having design cues from the sport of flat track racing, including the airbox location, dual exhaust pipes, lightweight appearance, in contradistinction to the usual American cruiser motorcycle,  and ""directly target[s] enthusiast riders who currently have traditionally favored the Ducati Monster, Triumph Speed Triple and BMW R nineT"". The ""sport"" model FTR1200S has electronic stability control and wheelie control, with gyroscopic input to the ABS and other systems to make them lean sensitive.","[{'match': 'standard', 'norm': 'standard', 'case': 'lower', 'exact': True, 'start': 40, 'end': 48}]",True,Other Financial Entity,"{'guideline': 0.30951938033103943, 'regulatory body': 0.2592432200908661, 'bank': 0.2566736936569214, 'policy': 0.21349778771400452}"
416,416,CTF,"Combined Task Force 150 (CTF-150) is a multinational coalition naval task force working under the 34-nation coalition of Combined Maritime Forces and is based in Bahrain established to monitor, board, inspect, and stop suspect shipping to pursue the ""Global War on Terrorism"" and in the Horn of Africa region (HOA) includes operations in the North Arabia Sea to support operations in the Indian Ocean. These activities are referred to as Maritime Security Operations (MSO).
Countries presently contributing to CTF-150 include Australia, Canada, Denmark, France, Pakistan, Japan, Germany, the United Kingdom and the United States. Other nations who have participated include Italy, India, Malaysia, Netherlands, New Zealand, Portugal, Singapore, Spain, Thailand and Turkey. The command of the task force rotates among the different participating navies, with commands usually lasting between four and six months. The task force usually comprises 14 or 15 ships. CTF-150 is coordinated by the Combined Maritime Forces (CMF), a 33-nation coalition operating from the US Navy base in Manama, Bahrain.","[{'match': 'board', 'norm': 'board', 'case': 'lower', 'exact': True, 'start': 194, 'end': 199}]",True,Non-Financial Entity,"{'regulatory body': 0.6134763956069946, 'guideline': 0.48909464478492737, 'policy': 0.39866140484809875, 'bank': 0.3962911367416382, 'finance': 0.05853184685111046}"
428,428,CAA,"DNS Certification Authority Authorization (CAA) is an Internet security policy mechanism that allows domain name holders to indicate to certificate authorities whether they are authorized to issue digital certificates for a particular domain name. It does this by means of a new ""CAA"" Domain Name System (DNS) resource record.
It was drafted by computer scientists Phillip Hallam-Baker and Rob Stradling in response to increasing concerns about the security of publicly trusted certificate authorities. It is an Internet Engineering Task Force (IETF) proposed standard.","[{'match': 'standard', 'norm': 'standard', 'case': 'lower', 'exact': True, 'start': 560, 'end': 568}]",True,Non-Financial Entity,"{'policy': 0.9809242486953735, 'guideline': 0.6356287598609924, 'regulatory body': 0.33631959557533264, 'bank': 0.20140624046325684, 'finance': 0.09619579464197159}"
436,436,BCBS,"BCBS 239 is the Basel Committee on Banking Supervision's standard number 239. The subject title of the standard is:
""Principles for effective risk data aggregation and risk reporting"".
The overall objective of the standard is to strengthen banks’ risk data aggregation capabilities and internal risk reporting practices, in turn, enhancing the risk management and decision making processes at banks.The standard was published in January 2013 and applies from 1st January 2016 for  Global Systemically Important Banks (G-SIBs) who were defined as such no later than November 2012, otherwise three years after their designation as G-SIBs. The standard also recommends that it is, by the national supervisors, applied to Domestic Systemically Important Banks (D-SIBs) three years after their designation as such.","[{'match': 'standard', 'norm': 'standard', 'case': 'lower', 'exact': True, 'start': 57, 'end': 65}, {'match': 'standard', 'norm': 'standard', 'case': 'lower', 'exact': True, 'start': 103, 'end': 111}, {'match': 'standard', 'norm': 'standard', 'case': 'lower', 'exact': True, 'start': 214, 'end': 222}, {'match': 'standard', 'norm': 'standard', 'case': 'lower', 'exact': True, 'start': 403, 'end': 411}, {'match': 'standard', 'norm': 'standard', 'case': 'lower', 'exact': True, 'start': 641, 'end': 649}]",True,regulatory body,"{'regulatory body': 0.9626775979995728, 'bank': 0.784173846244812, 'guideline': 0.5583685040473938, 'policy': 0.5533311367034912}"
445,445,GDPR,"The General Data Protection Regulation (EU) (GDPR) is a regulation in EU law on data protection and privacy in the European Union (EU) and the European Economic Area (EEA). The GDPR is an important component of EU privacy law and of human rights law, in particular Article 8(1) of the Charter of Fundamental Rights of the European Union. It also addresses the transfer of personal data outside the EU and EEA areas. The GDPR's primary aim is to enhance individuals' control and rights over their personal data and to simplify the regulatory environment for international business.  Superseding the Data Protection Directive 95/46/EC, the regulation contains provisions and requirements related to the processing of personal data of individuals (formally called data subjects in the GDPR) who are located in the EEA, and applies to any enterprise—regardless of its location and the data subjects' citizenship or residence—that is processing the personal information of individuals inside the EEA.
The GDPR was adopted on 14 April 2016 and became enforceable beginning 25 May 2018. As the GDPR is a regulation, not a directive, it is directly binding and applicable, and provides flexibility for certain aspects of the regulation to be adjusted by individual member states.
The regulation became a model for many other laws across the world, including in Turkey, Mauritius, Chile, Japan, Brazil, South Korea, South Africa, Argentina and Kenya. As of 2021 the United Kingdom retains the law in identical form despite no longer being an EU member state. The California Consumer Privacy Act (CCPA), adopted on 28 June 2018, has many similarities with the GDPR.","[{'match': 'directive', 'norm': 'directive', 'case': 'lower', 'exact': True, 'start': 1115, 'end': 1124}]",True,Non-Financial Entity,"{'regulatory body': 0.8975895047187805, 'policy': 0.599898636341095, 'bank': 0.25561124086380005, 'guideline': 0.20043601095676422, 'finance': 0.11001529544591904}"
451,451,CIR,"In mathematical finance, the Cox–Ingersoll–Ross (CIR) model describes the evolution of interest rates. It is a type of ""one factor model"" (short-rate model) as it describes interest rate movements as driven by only one source of market risk. The model can be used in the valuation of interest rate derivatives. It was introduced in 1985 by John C. Cox, Jonathan E. Ingersoll and Stephen A. Ross as an extension of the Vasicek model.

","[{'match': 'finance', 'norm': 'finance', 'case': 'lower', 'exact': True, 'start': 16, 'end': 23}]",True,Other Financial Entity,"{'bank': 0.28784802556037903, 'guideline': 0.23850710690021515, 'regulatory body': 0.11449749022722244, 'policy': 0.023580363020300865}"
452,452,SARB,"The South African Reserve Bank (SARB) is the central bank of South Africa.  It was established in 1921 after Parliament passed an act, the ""Currency and Bank Act of 10 August 1920"", as a direct result of the abnormal monetary and financial conditions which World War I had brought.  The SARB was only the fourth central bank established outside the United Kingdom and Europe, the others being the United States, Japan and Java. The earliest suggestions for the establishment of the Central Bank in South Africa date back to 1879. A select committee, of ten members of Parliament, was established on 31 March 1920 to examine the benefits to the national interest of the establishing of the central bank.Following on the recommendations of the committee, the South African Reserve Bank opened for business on 30 June 1921, making it the oldest central bank in Africa. The first banknotes were issued to the public by the Bank on 19 April 1922. Set of ZAR notes 2012 to present R 104 000 000 000.00 and Set of ZAR notes 2018 to present 400 000 000 print.
Unlike the Bank of England, which provided the model for establishing the SARB, the SARB is privately owned.

","[{'match': 'bank', 'norm': 'bank', 'case': 'lower', 'exact': True, 'start': 53, 'end': 57}, {'match': 'financial', 'norm': 'financial', 'case': 'lower', 'exact': True, 'start': 230, 'end': 239}, {'match': 'bank', 'norm': 'bank', 'case': 'lower', 'exact': True, 'start': 320, 'end': 324}, {'match': 'bank', 'norm': 'bank', 'case': 'lower', 'exact': True, 'start': 697, 'end': 701}, {'match': 'bank', 'norm': 'bank', 'case': 'lower', 'exact': True, 'start': 850, 'end': 854}]",True,regulatory body,"{'regulatory body': 0.828133225440979, 'bank': 0.8021097183227539, 'guideline': 0.42476606369018555, 'policy': 0.4099442660808563}"
453,453,SECP,"The Securities & Exchange Commission of Pakistan (SECP) (Urdu: ماموریہ تمسکات و مبادلہ پاکستان) is the financial regulatory agency in Pakistan whose objective is to develop a modern and efficient corporate sector and a capital market based on sound authority principles, in order to encourage investment and foster economic growth and prosperity in Pakistan.The SECP is a collegiate body with collective responsibility. The operational and executive authority of the SECP is vested in the Chairman who is the SECP's chief executive officer (CEO). The Chairman is assisted by four Commissioners to oversee the working of various operational units as may be determined by him. The SECP has nine company registration offices located at in Islamabad, Karachi, Lahore, Multan, Peshawar, Sukkur, Faisalabad, Quetta and Gilgit-Baltistan.

","[{'match': 'financial', 'norm': 'financial', 'case': 'lower', 'exact': True, 'start': 103, 'end': 112}]",True,regulatory body,"{'regulatory body': 0.9594858288764954, 'guideline': 0.6154704689979553, 'policy': 0.5129653811454773, 'bank': 0.2818005383014679}"
