,Unnamed: 0,acronym,summary,tags,has_tags,semantic_type,classification_data
133,133,LLC,"Citadel LLC (formerly known as Citadel Investment Group, LLC) is an American multinational hedge fund and financial services company. Founded in 1990 by Kenneth C. Griffin, it has more than US$50 billion in assets under management as of May 2022. The company has more than 1,400 employees, with corporate headquarters in Chicago, operational headquarters in Manhattan, and offices throughout North America, Asia, and Europe. Founder, CEO and Co-CIO Kenneth C. Griffin owns approximately 85% of the firm.Citadel LLC is a separate entity from the market maker Citadel Securities, although both were founded and are owned by American financier Kenneth C. Griffin.

","[{'match': 'fund', 'norm': 'fund', 'case': 'lower', 'exact': True, 'start': 97, 'end': 101}, {'match': 'financial', 'norm': 'financial', 'case': 'lower', 'exact': True, 'start': 106, 'end': 115}]",True,guideline,"{'guideline': 0.5409010052680969, 'regulatory body': 0.40292784571647644, 'policy': 0.3475273847579956, 'bank': 0.07911539077758789}"
134,134,KYC,"The know your customer or know your client (KYC) guidelines in financial services require that professionals make an effort to verify the identity, suitability, and risks involved with maintaining a business relationship. The procedures fit within the broader scope of a bank's anti-money laundering (AML) policy. KYC processes are also employed by companies of all sizes for the purpose of ensuring their proposed customers, agents, consultants, or distributors are anti-bribery compliant, and are actually who they claim to be. Banks, insurers, export creditors, and other financial institutions are increasingly demanding that customers provide detailed due diligence information. Initially, these regulations were imposed only on the financial institutions but now the non-financial industry, fintech, virtual assets dealers, and even non-profit organizations are liable to oblige.

","[{'match': 'financial', 'norm': 'financial', 'case': 'lower', 'exact': True, 'start': 63, 'end': 72}, {'match': 'bank', 'norm': 'bank', 'case': 'lower', 'exact': True, 'start': 271, 'end': 275}, {'match': 'money', 'norm': 'money', 'case': 'lower', 'exact': True, 'start': 283, 'end': 288}, {'match': 'financial', 'norm': 'financial', 'case': 'lower', 'exact': True, 'start': 575, 'end': 584}, {'match': 'financial', 'norm': 'financial', 'case': 'lower', 'exact': True, 'start': 738, 'end': 747}, {'match': 'financial', 'norm': 'financial', 'case': 'lower', 'exact': True, 'start': 777, 'end': 786}]",True,guideline,"{'guideline': 0.8812936544418335, 'policy': 0.7326834201812744, 'bank': 0.5681201219558716, 'regulatory body': 0.4712848663330078}"
135,135,MFDA,"The Mutual Fund Dealers Association of Canada (MFDA) is a Canadian self-regulatory organization (SRO) that provides oversight to dealers that distribute mutual funds and exempt fixed income products.  It is licensed under all Canadian provincial securities regulators (except Quebec, where it cooperates with the  AMF instead).  Its members consist of the distribution side of the industry that typically provide mutual funds and exempt fixed income products to Canadians through financial planners.
It works in parallel to another Canadian SRO, the Investment Industry Regulatory Organization of Canada (IIROC), which is responsible for the distribution of equities, ETFs, and other exchange traded products such as closed-end funds.","[{'match': 'securities', 'norm': 'securities', 'case': 'lower', 'exact': True, 'start': 246, 'end': 256}, {'match': 'financial', 'norm': 'financial', 'case': 'lower', 'exact': True, 'start': 480, 'end': 489}]",True,regulatory body,"{'regulatory body': 0.9781380891799927, 'guideline': 0.6271184086799622, 'policy': 0.43908634781837463, 'bank': 0.10829901695251465}"
144,144,BSA,"The Boy Scouts of America (BSA, colloquially the Boy Scouts) is one of the largest scouting organizations and one of the largest youth organizations in the United States, with about 1.2 million youth participants. The BSA was founded in 1910, and since then, about 110 million Americans have participated in BSA programs. BSA is part of the international Scout Movement and became a founding member organization of the World Organization of the Scout Movement in 1922.
The stated mission of the Boy Scouts of America is to ""prepare young people to make ethical and moral choices over their lifetimes by instilling in them the values of the Scout Oath and Law."" Youth are trained in responsible citizenship, character development, and self-reliance through participation in a wide range of outdoor activities, educational programs, and, at older age levels, career-oriented programs in partnership with community organizations. For younger members, the Scout method is part of the program to instill typical Scouting values such as trustworthiness, good citizenship, and outdoors skills, through a variety of activities such as camping, aquatics, and hiking. To further these outdoor activities, the BSA has four high-adventure bases: Northern Tier (Minnesota, Manitoba, and Ontario), Philmont Scout Ranch (New Mexico), Sea Base (Florida, US Virgin Islands, and Bahamas), and Summit Bechtel Reserve (West Virginia), as well as nearly one hundred separate camps and reservations specifically dedicated to scouts.
The main Scouting divisions are Cub Scouting for ages 5 to 11 years, Scouts BSA for ages 10 to 18, Venturing for ages 14 through 21, and Sea Scouts for ages 14 through 21. The BSA operates Scouting by chartering local organizations, such as churches, clubs, civic associations, or educational organization, to implement the Scouting program for youth within their communities. Units are led entirely by volunteers appointed by the chartering organization, who are supported by local councils using both paid professional Scouters and volunteers. Additionally, Learning for Life is an affiliate that provides in-school and career education.
On February 1, 2019, the Boy Scouts of America renamed its flagship program, Boy Scouts, to Scouts BSA to reflect its policy change allowing girls to join separate, gender-specific troops. Shortly thereafter, the largest charter organization supporting BSA, The Church of Jesus Christ of Latter-day Saints, decided to part ways substantially contributing to a net loss of nearly a million scouts/leaders. On February 18, 2020, the National BSA filed for Chapter 11 bankruptcy protection and is currently restructuring its financial situation. On November 16, 2020, the National BSA disclosed in their bankruptcy filings that over 92,000 former Scouts had reported sexual abuse by members of the organization. In December 2021, the insurer for the Boy Scouts of America agreed to pay $800M into the fund for victims.","[{'match': 'financial', 'norm': 'financial', 'case': 'lower', 'exact': True, 'start': 2673, 'end': 2682}, {'match': 'fund', 'norm': 'fund', 'case': 'lower', 'exact': True, 'start': 2949, 'end': 2953}]",True,policy,"{'policy': 0.7162250876426697, 'guideline': 0.6787447333335876, 'regulatory body': 0.655830979347229, 'bank': 0.2809378504753113}"
149,149,LTD,"NICE Ltd. (Hebrew: נייס) is an Israel-based company, specializing in contact center software (NICE CXone), telephone voice recording, data security, surveillance, and Robotic Process Automation as well as systems that analyze recorded data.
The company serves various industries, such as financial services, telecommunications, healthcare, outsourcers, retail, media, travel, service providers, and utilities.
The primary listing of the company's shares is on the Tel Aviv Stock Exchange; where it is part of the TA-35 Index.Barak Eilam became CEO in April 2014, replacing Zeevi Bregman. Eilam previously headed the company's Americas division. As of November, 2020 the company had ~6,800 employees.","[{'match': 'financial', 'norm': 'financial', 'case': 'lower', 'exact': True, 'start': 288, 'end': 297}]",True,guideline,"{'guideline': 0.7991406321525574, 'policy': 0.6256933212280273, 'regulatory body': 0.4610046148300171, 'bank': 0.1024344339966774}"
158,158,CRR,"Monetary policy is the process by which the monetary authority of a country, generally  central bank, controls the supply of money in the economy by its control over interest rates in order to maintain price stability and achieve high economic growth. In India, the central monetary authority is the Reserve Bank of India (RBI).
It is designed to maintain the price stability in the economy. Other objectives of the monetary policy of India, as stated by RBI, are:

Price stability
Price stability implies promoting economic development with considerable emphasis on price stability. The centre of focus is to facilitate the environment which is favourable to the architecture that enables the developmental projects to run swiftly while also maintaining reasonable price stability.Controlled expansion of bank credit
One of the important functions of RBI is the controlled expansion of bank credit and money supply with special attention to seasonal requirement for credit without affecting the output.Promotion of fixed investment
The aim here is to increase the productivity of investment by restraining non essential fixed investment.Restriction of inventories and stocks
Overfilling of stocks and products becoming outdated due to excess of stock often results in sickness of the unit. To avoid this problem, the central monetary authority carries out this essential function of restricting the inventories. The main objective of this policy is to avoid over-stocking and idle money in the organisation.Promoting efficiency
It tries to increase the efficiency in the financial system and tries to incorporate structural changes such as deregulating interest rates, easing operational constraints in the credit delivery system, introducing new money market instruments, etc.Reducing rigidity
RBI tries to bring about flexibilities in operations which provide a considerable autonomy. It encourages more competitive environment and diversification. It maintains its control over financial system whenever and wherever necessary to maintain the discipline and prudence in operations of the financial system.","[{'match': 'bank', 'norm': 'bank', 'case': 'lower', 'exact': True, 'start': 96, 'end': 100}, {'match': 'money', 'norm': 'money', 'case': 'lower', 'exact': True, 'start': 125, 'end': 130}, {'match': 'bank', 'norm': 'bank', 'case': 'lower', 'exact': True, 'start': 806, 'end': 810}, {'match': 'bank', 'norm': 'bank', 'case': 'lower', 'exact': True, 'start': 887, 'end': 891}, {'match': 'money', 'norm': 'money', 'case': 'lower', 'exact': True, 'start': 903, 'end': 908}, {'match': 'money', 'norm': 'money', 'case': 'lower', 'exact': True, 'start': 1482, 'end': 1487}, {'match': 'financial', 'norm': 'financial', 'case': 'lower', 'exact': True, 'start': 1572, 'end': 1581}, {'match': 'money', 'norm': 'money', 'case': 'lower', 'exact': True, 'start': 1748, 'end': 1753}, {'match': 'financial', 'norm': 'financial', 'case': 'lower', 'exact': True, 'start': 1982, 'end': 1991}, {'match': 'financial', 'norm': 'financial', 'case': 'lower', 'exact': True, 'start': 2092, 'end': 2101}]",True,policy,"{'policy': 0.9408607482910156, 'regulatory body': 0.7110056281089783, 'bank': 0.7097941040992737, 'guideline': 0.5101566910743713}"
160,160,CEN,"CEN/XFS or XFS (extensions for financial services) provides a client-server architecture for financial applications on the Microsoft Windows platform, especially peripheral devices such as EFTPOS terminals and ATMs which are unique to the financial industry. It is an international standard promoted by the European Committee for Standardization (known by the acronym CEN, hence CEN/XFS). The standard is based on the WOSA Extensions for Financial Services or WOSA/XFS developed by Microsoft.
With the move to a more standardized software base, financial institutions have been increasingly interested in the ability to pick and choose the application programs that drive their equipment.  XFS provides a common API for accessing and manipulating various financial services devices regardless of the manufacturer.","[{'match': 'financial', 'norm': 'financial', 'case': 'lower', 'exact': True, 'start': 31, 'end': 40}, {'match': 'financial', 'norm': 'financial', 'case': 'lower', 'exact': True, 'start': 93, 'end': 102}, {'match': 'financial', 'norm': 'financial', 'case': 'lower', 'exact': True, 'start': 239, 'end': 248}, {'match': 'standard', 'norm': 'standard', 'case': 'lower', 'exact': True, 'start': 282, 'end': 290}, {'match': 'standard', 'norm': 'standard', 'case': 'lower', 'exact': True, 'start': 393, 'end': 401}, {'match': 'financial', 'norm': 'financial', 'case': 'lower', 'exact': True, 'start': 545, 'end': 554}, {'match': 'financial', 'norm': 'financial', 'case': 'lower', 'exact': True, 'start': 755, 'end': 764}]",True,regulatory body,"{'regulatory body': 0.6268548369407654, 'bank': 0.46059712767601013, 'guideline': 0.35910269618034363, 'policy': 0.2767106592655182}"
162,162,FSA,"The Financial Services Authority (FSA) was a quasi-judicial body accountable for the regulation of the financial services industry in the United Kingdom between 2001 and 2013. It was founded as the Securities and Investments Board (SIB) in 1985. Its board was appointed by the Treasury, although it operated independently of government. It was structured as a company limited by guarantee and was funded entirely by fees charged to the financial services industry.Due to perceived regulatory failure of the banks during the financial crisis of 2007–2008, the UK government decided to restructure financial regulation and abolish the FSA. On 19 December 2012, the Financial Services Act 2012 received royal assent, abolishing the FSA with effect from 1 April 2013. Its responsibilities were then split between two new agencies: the Financial Conduct Authority and the Prudential Regulation Authority of the Bank of England.
Until its abolition, Lord Turner of Ecchinswell was the FSA's chairman and Hector Sants was CEO until the end of June 2012, having announced his resignation on 16 March 2012.Its main office was in Canary Wharf, London, with another office in Edinburgh. When acting as the competent authority for listing of shares on a stock exchange and maintaining the Official List, it was referred to as the UK Listing Authority (UKLA).

","[{'match': 'financial', 'norm': 'financial', 'case': 'lower', 'exact': True, 'start': 103, 'end': 112}, {'match': 'board', 'norm': 'board', 'case': 'lower', 'exact': True, 'start': 250, 'end': 255}, {'match': 'financial', 'norm': 'financial', 'case': 'lower', 'exact': True, 'start': 436, 'end': 445}, {'match': 'financial', 'norm': 'financial', 'case': 'lower', 'exact': True, 'start': 524, 'end': 533}, {'match': 'financial', 'norm': 'financial', 'case': 'lower', 'exact': True, 'start': 596, 'end': 605}]",True,regulatory body,"{'regulatory body': 0.9751061797142029, 'bank': 0.6172432899475098, 'policy': 0.5687103271484375, 'guideline': 0.5609579086303711}"
163,163,CFTC,"The Commodity Futures Trading Commission (CFTC) is an independent agency of the US government created in 1974, that regulates the U.S. derivatives markets, which includes futures, swaps, and certain kinds of options.
The Commodity Exchange Act (CEA), 7 U.S.C. § 1 et seq., prohibits fraudulent conduct in the trading of futures, swaps, and other derivatives.  The stated mission of the CFTC is to promote the integrity, resilience, and vibrancy of the U.S. derivatives markets through sound regulation. After the financial crisis of 2007–08 and since 2010 with the Dodd–Frank Wall Street Reform and Consumer Protection Act, the CFTC has been transitioning to bring more transparency and sound regulation to the multitrillion dollar swaps market.

","[{'match': 'financial', 'norm': 'financial', 'case': 'lower', 'exact': True, 'start': 513, 'end': 522}]",True,regulatory body,"{'regulatory body': 0.978188693523407, 'guideline': 0.6043060421943665, 'policy': 0.5145336985588074, 'bank': 0.18052548170089722}"
164,164,PTY,"A proprietary company,  the characteristic of which is abbreviated as ""Pty"", is a form of privately held company in Australia and South Africa that is either limited or unlimited. However, unlike a public company there are, depending on jurisdiction, restrictions on what it can and cannot do.
In Australia, a proprietary company is defined under section 45A(1) of the Corporations Act 2001 (Cth).The Act puts certain restrictions on proprietary companies such as not permitting them to have more than 50 members (shareholders). Another important restriction relates to fundraising.  A proprietary company must not engage in fundraising that would require a disclosure document such as a prospectus, an offer information statement, or a profile statement to be issued (sec.113(3)).  The Act states in which circumstances a company must issue a prospectus when attempting to raise funds.  This means that a proprietary company must not offer its shares to the public.
Section 45A of the Act also distinguishes proprietary companies as either ""large proprietary"" or ""small proprietary"".  The differences here relate to issues such as operating revenue, consolidated gross assets, and the number of employed persons.
Large proprietary companies are required to appoint an auditor and lodge appropriate financial statements with the Australian Securities and Investments Commission (ASIC).","[{'match': 'financial', 'norm': 'financial', 'case': 'lower', 'exact': True, 'start': 1299, 'end': 1308}]",True,regulatory body,"{'regulatory body': 0.6898882389068604, 'guideline': 0.36459022760391235, 'policy': 0.25910699367523193, 'bank': 0.1684844046831131}"
165,165,FMI,"The Functional Mock-up Interface (or FMI) defines a standardized interface to be used in computer simulations to develop complex cyber-physical systems.
The vision of FMI is to support this approach: if the real product is to be assembled from a wide range of parts interacting in complex ways, each controlled by a complex set of physical laws, then it should be possible to create a virtual product that can be assembled from a set of models that each represent a combination of parts, each a model of the physical laws as well as a model of the control systems (using electronics, hydraulics, and digital software) assembled digitally. The FMI standard thus provides the means for model based development of systems and is used for example for designing functions that are driven by electronic devices inside vehicles (e.g. ESP controllers, active safety systems, combustion controllers). Activities from systems modelling, simulation, validation and test can be covered with the FMI based approach. 
To create the FMI standard, a large number of software companies and research centers have worked in a cooperation project established through a European consortium  that has been conducted by Dassault Systèmes under the name of MODELISAR. The MODELISAR project started in 2008 to define the FMI specifications, deliver technology studies, prove the FMI concepts through use cases elaborated by the consortium partners and enable tool vendors to build advanced prototypes or in some cases even products. The development of the FMI specifications was coordinated by Daimler AG. After the end of the MODELISAR project in 2011, FMI is managed and developed as a Modelica Association Project (MAP).
The four required FMI aspects of creating models capable of being assembled have been covered in Modelisar project: 

FMI for model exchange,
FMI for co-simulation,
FMI for applications,
FMI for PLM (integration of models and related data in product life-cycle management).In practice, the FMI implementation by a software modelling tool enables the creation of a simulation model that can be interconnected or the creation of a software library called FMU (Functional Mock-up Unit).

","[{'match': 'standard', 'norm': 'standard', 'case': 'lower', 'exact': True, 'start': 647, 'end': 655}, {'match': 'standard', 'norm': 'standard', 'case': 'lower', 'exact': True, 'start': 1022, 'end': 1030}]",True,Non-Financial Entity,"{'regulatory body': 0.3109292984008789, 'guideline': 0.29977819323539734, 'policy': 0.25684860348701477, 'bank': 0.14951759576797485, 'finance': 0.07544329017400742}"
191,191,CBK,"The President of Sri Lanka (Sinhala: ශ්‍රී ලංකා ජනාධිපති Śrī Laṃkā Janādhipathi; Tamil: இலங்கை சனாதிபதி Ilankai janātipati) is the head of state, chief executive, and de jure head of government of the Democratic Socialist Republic of Sri Lanka. The president is the chief executive of the union government and the commander-in-chief of the Sri Lanka Armed Forces.
The office was created in 1972 as a ceremonial head of state. Until 1972, Ceylon was a Commonwealth realm with Queen Elizabeth II as the head of state and Queen of Ceylon. It became an executive post in 1978, and since then has been the single most dominant political office in the country. 
Prime Minister Ranil Wickremesinghe became the acting president on 13 July 2022, after his predecessor Gotabaya Rajapaksa fled the country on 13 July 2022. Rajapaksa resigned on 14 July 2022. On 15 July 2022, Wickremesinghe was sworn in as acting president of Sri Lanka. The same day, he decided to formally abolish the presidential standard and remove the style ""His Excellency"" when addressing the president. On July 20, 2022, Wickremesinghe was elected as the ninth President by parliament in a secret ballot.

","[{'match': 'standard', 'norm': 'standard', 'case': 'lower', 'exact': True, 'start': 989, 'end': 997}]",True,Non-Financial Entity,"{'regulatory body': 0.576255202293396, 'guideline': 0.29288169741630554, 'policy': 0.2660976052284241, 'bank': 0.2380392849445343, 'finance': 0.13891474902629852}"
202,202,AFSA,"The Council of School Supervisors & Administrators (CSA) is a New York City based collective bargaining unit for principals, assistant principals, supervisors and education administrators who work in the New York City public schools and directors and assistant directors who work in city-funded day care. It was founded in 1962 as the Council of Supervisory Associations.Since its inception, the CSA has played a major role in NYC public schools, including arguing successfully for salary increases, a salary index, and creating a welfare fund for its employees. It became a member of the AFL–CIO in 1971 as part of a new national organization.

","[{'match': 'fund', 'norm': 'fund', 'case': 'lower', 'exact': True, 'start': 539, 'end': 543}]",True,Non-Financial Entity,"{'regulatory body': 0.8017189502716064, 'guideline': 0.5435190200805664, 'policy': 0.5110299587249756, 'finance': 0.2800880968570709, 'bank': 0.033518075942993164}"
203,203,CSSF,"The Commission de Surveillance du Secteur Financier (CSSF) is responsible for the financial regulation in Luxembourg. The CSSF is responsible for the supervision of credit institutions, experts in the financial sector, investment companies, pension funds, regulated securities markets and their operators, multilateral trading facilities and payment institutions. The CSSF is the competent authority for the public auditor oversight.

","[{'match': 'financial', 'norm': 'financial', 'case': 'lower', 'exact': True, 'start': 82, 'end': 91}, {'match': 'financial', 'norm': 'financial', 'case': 'lower', 'exact': True, 'start': 201, 'end': 210}, {'match': 'securities', 'norm': 'securities', 'case': 'lower', 'exact': True, 'start': 266, 'end': 276}]",True,regulatory body,"{'regulatory body': 0.9842114448547363, 'guideline': 0.4635830819606781, 'policy': 0.44033414125442505, 'bank': 0.37971580028533936}"
206,206,HKMA,"Hong Kong maintains a three-tier system of deposit-taking institutions, i.e. licensed banks, restricted licence banks and deposit-taking companies. They are collectively known as authorized institutions supervised by the Hong Kong Monetary Authority (HKMA).As one of the top five financial centres worldwide, Hong Kong has one of the highest concentrations of banking institutions in the world, with 70 of the largest 100 banks in the world having an operation in Hong Kong. As of 2019, there were 164 licensed banks, 17 restricted licence banks and 13 deposit-taking companies in business, constituting a total of 194 authorized institutions. In addition, there are 42 local representative offices of foreign banks in Hong Kong.","[{'match': 'financial', 'norm': 'financial', 'case': 'lower', 'exact': True, 'start': 280, 'end': 289}]",True,regulatory body,"{'regulatory body': 0.9274051785469055, 'bank': 0.7575981616973877, 'guideline': 0.22612427175045013, 'policy': 0.21492338180541992}"
