,Unnamed: 0,acronym,summary,tags,has_tags,semantic_type,classification_data
663,663,ABN,"ABN AMRO Bank N.V. is a Dutch bank with headquarters in Amsterdam. ABN AMRO Bank is the third-largest bank in the Netherlands. It was re-established in its current form in 2009, following the acquisition and break-up of the original ABN AMRO by a banking consortium consisting of Royal Bank of Scotland Group, Santander Group and Fortis. Following the collapse of Fortis, who acquired the Dutch business, it was nationalized by the Dutch government along with Fortis Bank Nederland. It was relisted as a public company again in 2015.
The bank is a product of a long history of mergers and acquisitions that date to 1765. In 1991, Algemene Bank Nederland (ABN) and AMRO Bank (itself the result of a merger of the Amsterdamsche Bank and the Rotterdamsche Bank in the 1960s) agreed to merge to create the original ABN AMRO.
In July 2006, Favonius Ventures, which was founded and headed by Roel Pieper, received all of the technology investments of ABN AMRO Capital which is the private equity business unit of ABN AMRO Bank N.V.By 2007, ABN AMRO was the second-largest bank in the Netherlands and the eighth-largest in Europe by assets. At that time the magazine The Banker and Fortune Global 500 placed it 15th in the list of world's biggest banks and it had operations in 63 countries, with over 110,000 employees.
In October 2007, a consortium of the Royal Bank of Scotland Group, Fortis and Banco Santander, known as RFS Holdings B.V. acquired the bank, in what was the world's biggest bank takeover to date. Consequently, the bank was divided into three parts, each owned by one of the members of the consortium. However, RBS and Fortis soon ran into serious trouble: the large debt created to fund the takeover had depleted the banks' reserves just as the financial crisis of 2007–2010 started. As a result, the Dutch government stepped in and bailed out Fortis in October 2008, before splitting ABN AMRO's Dutch assets (which had primarily been allocated to Fortis) from those owned by RBS, which were effectively assumed by the UK government due to its bail-out of the British bank. The operations owned by Santander, notably those in Italy and Brazil, were merged with Santander, sold or eliminated.
The Dutch government appointed former Dutch finance minister Gerrit Zalm as CEO to restructure and stabilise the bank, and in February 2010 the assets it owned were legally demerged from those owned by RBS. This demerger created two separate organisations, ABN AMRO Bank N.V. and The Royal Bank of Scotland N.V. The former was merged with ABN AMRO Private Banking, Fortis Bank Nederland, the private bank MeesPierson (formerly owned by the original ABN AMRO and Fortis) and the diamond bank International Diamond & Jewelry Group to create ABN AMRO Group N.V., with the Fortis name being dropped on 1 July 2010. The remaining parts of the original ABN AMRO still owned by The Royal Bank of Scotland N.V., meanwhile, were renamed, sold or closed.The Dutch government has said that ABN AMRO would remain state-owned until at least 2014. On November 20, 2015, the Dutch government publicly re-listed the company through an IPO and sold 20% of the shares to the public.In November 2020, ABN Amro announced it would cut 2800 jobs and sell its head offices as a plan to reduce costs, hoping to save €700 million by 2024.","[{'match': 'bank', 'norm': 'bank', 'case': 'lower', 'exact': True, 'start': 30, 'end': 34}, {'match': 'bank', 'norm': 'bank', 'case': 'lower', 'exact': True, 'start': 102, 'end': 106}, {'match': 'bank', 'norm': 'bank', 'case': 'lower', 'exact': True, 'start': 538, 'end': 542}, {'match': 'bank', 'norm': 'bank', 'case': 'lower', 'exact': True, 'start': 1066, 'end': 1070}, {'match': 'bank', 'norm': 'bank', 'case': 'lower', 'exact': True, 'start': 1449, 'end': 1453}, {'match': 'bank', 'norm': 'bank', 'case': 'lower', 'exact': True, 'start': 1487, 'end': 1491}, {'match': 'bank', 'norm': 'bank', 'case': 'lower', 'exact': True, 'start': 1528, 'end': 1532}, {'match': 'fund', 'norm': 'fund', 'case': 'lower', 'exact': True, 'start': 1696, 'end': 1700}, {'match': 'financial', 'norm': 'financial', 'case': 'lower', 'exact': True, 'start': 1759, 'end': 1768}, {'match': 'bank', 'norm': 'bank', 'case': 'lower', 'exact': True, 'start': 2082, 'end': 2086}, {'match': 'finance', 'norm': 'finance', 'case': 'lower', 'exact': True, 'start': 2250, 'end': 2257}, {'match': 'bank', 'norm': 'bank', 'case': 'lower', 'exact': True, 'start': 2319, 'end': 2323}, {'match': 'bank', 'norm': 'bank', 'case': 'lower', 'exact': True, 'start': 2606, 'end': 2610}, {'match': 'bank', 'norm': 'bank', 'case': 'lower', 'exact': True, 'start': 2692, 'end': 2696}]",True,bank,"{'bank': 0.5885224938392639, 'regulatory body': 0.13656318187713623, 'policy': 0.05482698976993561, 'guideline': 0.015591618604958057}"
668,668,CVM,"Contactless payment systems are credit cards and debit cards, key fobs, smart cards, or other devices, including smartphones and other mobile devices, that use radio-frequency identification (RFID) or near-field communication (NFC, e.g. Samsung Pay, Apple Pay, Google Pay, Fitbit Pay, or any bank mobile application that supports contactless) for making secure payments. The embedded integrated circuit chip and antenna enable consumers to wave their card, fob, or handheld device over a reader at the point of sale terminal.  Contactless payments are made in close physical proximity, unlike other types of mobile payments which use broad-area cellular or WiFi networks and do not involve close physical proximity.
EMV is a common standard used by major credit card and smartphone companies for use in general commerce. Contactless smart cards that function as  stored-value cards are becoming popular for use as transit system farecards, such as the Oyster card or RioCard.  These can often store non-currency value (such as monthly passes), in additional to fare value purchased with cash or electronic payment.
Tokenisation is a newer concept of encapsulating a card issuers details within a hardware device application such as via Apple Pay app on iPhones.
Some suppliers claim that transactions can be almost twice as fast as a conventional cash, credit, or debit card purchase. Because no signature or PIN verification is typically required, contactless purchases are usually limited to small value sales. Lack of authentication provides a window during which fraudulent purchases can be made while the card owner is unaware of the card's loss.
Major financial institutions and multinational corporations now offer contactless payment systems to customers as contactless credit cards have become widespread in the U.S., U.K., Japan, Germany, Canada, Australia, France, the Netherlands, etc., as consumers are likely to spend more money using their cards due to the ease of small transactions. With contactless cards growing in numbers and percentages of adoption, the number of payments by this method had increased significantly since the spending limit was raised. Purchases made by card now surpass those made by cash and account for approximately one-third of all card transactions in countries like the UK. Contactless payments specifically have become increasingly popular, accounting for 4 out of 5 point-of-sale purchases in Australia as of 2019. Card issuers indicate that they will increase the availability of contactless cards to consumers. There are over 58 million contactless-enabled cards and over 147,000 terminals in use in the UK alone, VISA estimated that there would be 300 million contactless cards issued in the US by the end of 2020, up from the predicted 100 million at the end of 2019.

","[{'match': 'bank', 'norm': 'bank', 'case': 'lower', 'exact': True, 'start': 292, 'end': 296}, {'match': 'standard', 'norm': 'standard', 'case': 'lower', 'exact': True, 'start': 732, 'end': 740}, {'match': 'financial', 'norm': 'financial', 'case': 'lower', 'exact': True, 'start': 1658, 'end': 1667}, {'match': 'money', 'norm': 'money', 'case': 'lower', 'exact': True, 'start': 1937, 'end': 1942}]",True,bank,"{'bank': 0.7667004466056824, 'regulatory body': 0.4321807026863098, 'policy': 0.3535601496696472, 'guideline': 0.25123104453086853}"
669,669,AFS,"""Aft"", in nautical terminology, is an adjective or adverb meaning towards the stern (rear) of the ship, aircraft or spacecraft, when the frame of reference is within the ship, headed at the fore. For example, ""Able Seaman Smith; lie aft!"" or ""What's happening aft?"".
The corresponding adjective in distinguishing one feature of the vessel from another is ""after"". Its antonym is ""forward"".
The corresponding preposition is ""abaft"". For example, the mizzenmast is abaft the mainmast. Its antonym is ""before"" or, in a more clumsy form, ""forward of"".
The difference between ""aft"" and ""stern"" is that aft is the inside (on board) rearmost part of the vessel, while stern refers to the outside (offboard) rearmost part of the vessel. The stern is opposite the bow, the outside (offboard) of the front of the boat.
The term derives from the Old English æftan (“behind”).","[{'match': 'board', 'norm': 'board', 'case': 'lower', 'exact': True, 'start': 619, 'end': 624}]",True,Non-Financial Entity,"{'guideline': 0.5163348913192749, 'regulatory body': 0.49594810605049133, 'finance': 0.15356311202049255, 'policy': 0.14441844820976257, 'bank': 0.13380460441112518}"
671,671,TRANS,"Transgender people have a gender identity or gender expression that differs from the sex that they were assigned at birth. Some transgender people who desire medical assistance to transition from one sex to another identify as transsexual. Transgender, often shortened as trans, is also an umbrella term; in addition to including people whose gender identity is the opposite of their assigned sex (trans men and trans women), it may also include people who are non-binary or genderqueer. Other definitions of transgender also include people who belong to a third gender, or else conceptualize transgender people as a third gender. The term transgender may be defined very broadly to include cross-dressers. The term transgender does not have a universally accepted definition, including among researchers.Being transgender is distinct from sexual orientation. Transgender people may identify as heterosexual (straight), homosexual (gay or lesbian), bisexual, asexual, or otherwise, or may decline to label their sexual orientation. The opposite of transgender is cisgender, which describes persons whose gender identity matches their assigned sex. Accurate statistics on the number of transgender people vary widely, in part due to different definitions of what constitutes being transgender. Some countries, such as Canada, collect census data on transgender people. Transgender occurrence is generally found in less than 1% of the worldwide population, with figures ranging from <0.1% to 0.6%.The degree to which individuals feel genuine, authentic, and comfortable within their external appearance and accept their genuine identity has been called transgender congruence. Many transgender people experience gender dysphoria, and some seek medical treatments such as hormone replacement therapy, sex reassignment surgery, or psychotherapy. Not all transgender people desire these treatments, and some cannot undergo them for financial or medical reasons.Many transgender people face discrimination in the workplace and in accessing public accommodations and healthcare. In many places, they are not legally protected from discrimination.","[{'match': 'financial', 'norm': 'financial', 'case': 'lower', 'exact': True, 'start': 1927, 'end': 1936}]",True,regulatory body,"{'regulatory body': 0.7101608514785767, 'policy': 0.5622677206993103, 'guideline': 0.5455137491226196, 'bank': 0.4609896242618561}"
679,679,FSCA,The Financial Sector Conduct Authority (FSCA) is a financial institutions market conduct regulator and a successor agency to the Financial Services Board (South Africa) in South Africa.,"[{'match': 'financial', 'norm': 'financial', 'case': 'lower', 'exact': True, 'start': 51, 'end': 60}]",True,regulatory body,"{'regulatory body': 0.9872297048568726, 'bank': 0.5304936170578003, 'policy': 0.3458678126335144, 'guideline': 0.295022577047348}"
691,691,MPC,"The Akai MPC (originally MIDI Production Center, now Music Production Center) is a series of music workstations produced by Akai from 1988 onwards. MPCs combine sampling and sequencing functions, allowing users to record portions of sound, modify them and play them back as sequences. 
The first MPCs were designed by Roger Linn, who had designed the successful LM-1 and LinnDrum drum machines in the 1980s. Linn aimed to create an intuitive instrument, with a grid of pads that can be played similarly to a traditional instrument such as a keyboard or drum kit. Rhythms can be built not just from samples of percussion but samples of any recorded sound. 
The MPC had a major influence on the development of electronic and hip hop music. It led to new sampling techniques, with users pushing its technical limits to creative effect. It had a democratizing effect on music production, allowing artists to create elaborate tracks without traditional instruments or recording studios. Its pad interface was adopted by numerous manufacturers and became standard in DJ technology. 
Notable users of the MPC include the American producer DJ Shadow, who used an MPC to create his influential 1996 album Endtroducing; the American producer J Dilla, who disabled its quantize feature to create signature ""off-kilter"" rhythms; and the rapper Kanye West, who used it to compose several of his best-known tracks. MPCs continue to be used in music, even with the advent of digital audio workstations.

","[{'match': 'standard', 'norm': 'standard', 'case': 'lower', 'exact': True, 'start': 1049, 'end': 1057}]",True,Non-Financial Entity,"{'guideline': 0.42815661430358887, 'regulatory body': 0.3544672131538391, 'bank': 0.34012332558631897, 'policy': 0.2729995548725128, 'finance': 0.014584115706384182}"
700,700,EIOPA,"The European Insurance and Occupational Pensions Authority (EIOPA) is a European Union financial regulatory institution that replaced the Committee of European Insurance and Occupational Pensions Supervisors (CEIOPS). It is established under EU Regulation 1094/2010.
EIOPA is one of the three European Supervisory Authorities responsible for microprudential oversight at the European Union level, being part of the European System of Financial Supervision. Current chair is Petra Hielkema.","[{'match': 'financial', 'norm': 'financial', 'case': 'lower', 'exact': True, 'start': 87, 'end': 96}]",True,regulatory body,"{'regulatory body': 0.9944566488265991, 'guideline': 0.6237056851387024, 'policy': 0.5273074507713318, 'bank': 0.14302659034729004}"
702,702,LCH,"LCH (originally London Clearing House) is a British clearing house group that serves major international exchanges, as well as a range of OTC markets. The LCH Group consists of two subsidiaries: LCH Ltd (based in London) and LCH SA (based in Paris). Based on 2012 figures, LCH cleared approximately 50% of the global interest rate swap market, and was the second largest clearer of bonds and repos in the world, providing services across 13 government debt markets. In addition, LCH clears a broad range of asset classes including: commodities, securities, exchange traded derivatives, credit default swaps, energy contracts, freight derivatives, interest rate swaps, foreign exchange and Euro and Sterling denominated bonds and repos.
LCH's members comprise many of the major financial groups including almost all of the major investment banks, broker dealers and international commodity houses. LCH, being a clearing house, sits in the middle of a trade assuming the counterparty risk involved when two parties trade guaranteeing the settlement of the trade. To mitigate the risks involved it imposes certain minimum requirements on its members and collects initial and variation margin (or collateral) from them for trades that have been executed.

","[{'match': 'securities', 'norm': 'securities', 'case': 'lower', 'exact': True, 'start': 545, 'end': 555}, {'match': 'financial', 'norm': 'financial', 'case': 'lower', 'exact': True, 'start': 777, 'end': 786}]",True,regulatory body,"{'regulatory body': 0.7075983285903931, 'bank': 0.602645218372345, 'guideline': 0.5731055736541748, 'policy': 0.4585523009300232}"
704,704,FIA,"Formula One (also known as Formula 1 or F1) is the highest class of international racing for open-wheel single-seater formula racing cars sanctioned by the Fédération Internationale de l'Automobile (FIA). The World Drivers' Championship, which became the FIA Formula One World Championship in 1981, has been one of the premier forms of racing around the world since its inaugural season in 1950. The word formula in the name refers to the set of rules to which all participants' cars must conform. A Formula One season consists of a series of races, known as Grands Prix, which take place worldwide on both purpose-built circuits and closed public roads.
A points system is used at Grands Prix to determine two annual World Championships: one for drivers, the other for constructors. Each driver must hold a valid Super Licence, the highest class of racing licence issued by the FIA. The races must run on tracks graded ""1"" (formerly ""A""), the highest grade-rating issued by the FIA.Formula One cars are the fastest regulated road-course racing cars in the world, owing to very high cornering speeds achieved through the generation of large amounts of aerodynamic downforce.  Much of this downforce is generated by front and rear wings, which have the side effect of causing severe turbulence behind each car. The turbulence reduces the downforce generated by a car following directly behind, making it hard to overtake. Major changes to the cars for the 2022 season has seen greater use of ground effect aerodynamics, and modified wings to reduce the turbulence behind the cars, with the goal of making overtaking easier. The cars are dependent on electronics and aerodynamics, suspension and tyres. Traction control, launch control, and automatic shifting, plus other electronic driving aids, were first banned in 1994. They were briefly reintroduced in 2001, and have more recently been banned since 2004 and 2008, respectively.With the average annual cost of running a team – designing, building, and maintaining cars, pay, transport – being approximately US$247 million, its financial and political battles are widely reported. On 23 January 2017, Liberty Media completed its acquisition of the Formula One Group, from private-equity firm CVC Capital Partners for $8 billion.","[{'match': 'financial', 'norm': 'financial', 'case': 'lower', 'exact': True, 'start': 2080, 'end': 2089}]",True,regulatory body,"{'regulatory body': 0.9289340376853943, 'guideline': 0.2792954742908478, 'policy': 0.20105133950710297, 'bank': 0.06792275607585907}"
724,724,RMB,"RMB Holdings Limited (RMBH), previously known as Rand Merchant Bank Holdings, is a South African diversified financial services holding company.

","[{'match': 'financial', 'norm': 'financial', 'case': 'lower', 'exact': True, 'start': 109, 'end': 118}]",True,bank,"{'bank': 0.913391649723053, 'guideline': 0.3616487383842468, 'policy': 0.17223431169986725, 'regulatory body': 0.023363733664155006}"
734,734,SMF,"10 Gigabit Ethernet (10GE, 10GbE, or 10 GigE) is a group of computer networking technologies for transmitting Ethernet frames at a rate of 10 gigabits per second. It was first defined by the IEEE 802.3ae-2002 standard. Unlike previous Ethernet standards, 10 Gigabit Ethernet defines only full-duplex point-to-point links which are generally connected by network switches; shared-medium CSMA/CD operation has not been carried over from the previous generations Ethernet standards so half-duplex operation and repeater hubs do not exist in 10GbE.The 10 Gigabit Ethernet standard encompasses a number of different physical layer (PHY) standards. A networking device, such as a switch or a network interface controller may have different PHY types through pluggable PHY modules, such as those based on SFP+. Like previous versions of Ethernet, 10GbE can use either copper or fiber cabling.  Maximum distance over copper cable is 100 meters but because of its bandwidth requirements, higher-grade cables are required.The adoption of 10 Gigabit Ethernet has been more gradual than previous revisions of Ethernet: in 2007, one million 10GbE ports were shipped, in 2009 two million ports were shipped, and in 2010 over three million ports were shipped, with an estimated nine million ports in 2011. As of 2012, although the price per gigabit of bandwidth for 10 Gigabit Ethernet was about one-third compared to Gigabit Ethernet, the price per port of 10 Gigabit Ethernet still hindered more widespread adoption.

","[{'match': 'standard', 'norm': 'standard', 'case': 'lower', 'exact': True, 'start': 209, 'end': 217}, {'match': 'standard', 'norm': 'standard', 'case': 'lower', 'exact': True, 'start': 568, 'end': 576}]",True,Non-Financial Entity,"{'regulatory body': 0.4983319938182831, 'guideline': 0.35468828678131104, 'policy': 0.31503602862358093, 'finance': 0.28006553649902344, 'bank': 0.25740647315979004}"
747,747,PROJET,"The Relief Project is an organization of musicians who want to deliver aid to communities in need.
Brad Corrigan, a member of Dispatch, and Jon-Erik Borgen a member of J.E. Borgen, established The Relief Project. The initial goal of the project was to help the victims of Hurricane Katrina and other people caught in mass disasters throughout the world.  Started by two musicians, nineteen other musicians donated a piece of music that together became a CD called The Relief Project, Vol 1.
The Relief Project promoted a concert at Irving Plaza.  This concert was performed in front of a sold-out crowd of 1,000 and some of the featured artists who performed at Irving Plaza were Dispatch, State Radio, Stephen Kellogg, Braddigan, Pete Francis, Kate Voegele, and J.E. Borgen.  The Relief Project gave $18,000 to the Community Service Center of New Orleans and to Save the Children's operations in Sudan and Pakistan.
The mission of The Relief Project is

“to use music as a tool to rebuild lives; To use music as a tool to rebuild lives; a bridge to bring cultures together in the fight against poverty; and a voice calling for the protection and liberation of displaced and orphaned children the world over”.

The vision of The Relief Project is to use music as a way to raise money, educate and inspire people to engage in a livelier role in caring for humanity","[{'match': 'money', 'norm': 'money', 'case': 'lower', 'exact': True, 'start': 1278, 'end': 1283}]",True,Non-Financial Entity,"{'regulatory body': 0.5017188787460327, 'guideline': 0.42849448323249817, 'bank': 0.39821767807006836, 'finance': 0.2757125496864319, 'policy': 0.24340137839317322}"
751,751,NFA,"In automata theory (a branch of theoretical computer science), NFA minimization is the task of transforming a given nondeterministic finite automaton (NFA) into an equivalent NFA that has a minimum number of states, transitions, or both. While efficient algorithms exist for DFA minimization, NFA minimization is PSPACE-complete. No efficient (polynomial time) algorithms are known, and under the standard assumption P ≠ PSPACE, none exist. The most efficient known algorithm is the Kameda‒Weiner algorithm.","[{'match': 'standard', 'norm': 'standard', 'case': 'lower', 'exact': True, 'start': 397, 'end': 405}]",True,Non-Financial Entity,"{'guideline': 0.09274096041917801, 'regulatory body': 0.030406327918171883, 'bank': 0.024155879393219948, 'policy': 0.006922092754393816, 'finance': 0.00021266182011459023}"
758,758,LRO,"Cult Energy Pro Cycling (UCI team code: CUL) was a professional road bicycle racing team licensed in Denmark, that competed in the UCI Continental Circuits. It was established in 2000 under the name of ""Cycling Horsens"".
On September 9, 2014, the team announced they had signed Linus Gerdemann from MTN–Qhubeka on a 2-year contract.
On October 10, 2014, the team announced they had signed Gustav Larsson on a one-year contract
In August 2015, the team seemed to secure its survival after gaining sponsorship from German company Stölting Group, which sponsored the Continental team Stölting in 2015. As a result, the teams planned to join forces, giving the necessary budget to ensure the team could stay in the Professional Continental tier for 2016. However, December 2015 Cult announced they would exit the sport and no longer be able to fund the team - as a result, Stölting stepped into the fill the funding void. As a result, the Danish team disbanded.","[{'match': 'fund', 'norm': 'fund', 'case': 'lower', 'exact': True, 'start': 840, 'end': 844}]",True,regulatory body,"{'regulatory body': 0.7561348080635071, 'guideline': 0.48655107617378235, 'bank': 0.41481173038482666, 'policy': 0.3446781039237976}"
