,Unnamed: 0,acronym,summary,tags,has_tags,semantic_type,classification_data
2,2,AML,"The know your customer or know your client (KYC) guidelines in financial services require that professionals make an effort to verify the identity, suitability, and risks involved with maintaining a business relationship. The procedures fit within the broader scope of a bank's anti-money laundering (AML) policy. KYC processes are also employed by companies of all sizes for the purpose of ensuring their proposed customers, agents, consultants, or distributors are anti-bribery compliant, and are actually who they claim to be. Banks, insurers, export creditors, and other financial institutions are increasingly demanding that customers provide detailed due diligence information. Initially, these regulations were imposed only on the financial institutions but now the non-financial industry, fintech, virtual assets dealers, and even non-profit organizations are liable to oblige.

","[{'match': 'financial', 'norm': 'financial', 'case': 'lower', 'exact': True, 'start': 63, 'end': 72}, {'match': 'bank', 'norm': 'bank', 'case': 'lower', 'exact': True, 'start': 271, 'end': 275}, {'match': 'money', 'norm': 'money', 'case': 'lower', 'exact': True, 'start': 283, 'end': 288}, {'match': 'financial', 'norm': 'financial', 'case': 'lower', 'exact': True, 'start': 575, 'end': 584}, {'match': 'financial', 'norm': 'financial', 'case': 'lower', 'exact': True, 'start': 738, 'end': 747}, {'match': 'financial', 'norm': 'financial', 'case': 'lower', 'exact': True, 'start': 777, 'end': 786}]",True,guideline,"{'guideline': 0.8812936544418335, 'policy': 0.7326834201812744, 'bank': 0.5681201219558716, 'regulatory body': 0.4712848663330078}"
12,12,SFC,"The Galway county football team represents Galway in men's Gaelic football and is governed by Galway GAA, the county board of the Gaelic Athletic Association. The team competes in the three major annual inter-county competitions; the All-Ireland Senior Football Championship, the Connacht Senior Football Championship and the National Football League.
Galway's home ground is Pearse Stadium, Salthill. The team's manager is Pádraic Joyce.
Galway was the first Connacht county to win an All-Ireland Senior Football Championship (SFC), but the second to appear in the final, following Mayo. It has nine All-Ireland SFCs, the third highest total after Kerry and Dublin. It won three consecutive All-Ireland SFCs in the mid-1960s and, from 1998 onwards, two All-Ireland SFC titles in four years. The team last won the Connacht Senior Championship in 2022, the All-Ireland Senior Championship in 2001 and the National League in 1981.","[{'match': 'board', 'norm': 'board', 'case': 'lower', 'exact': True, 'start': 117, 'end': 122}]",True,Non-Financial Entity,"{'regulatory body': 0.8917790651321411, 'guideline': 0.6545599699020386, 'policy': 0.4879588484764099, 'bank': 0.3092542886734009, 'finance': 0.2930116653442383}"
13,13,FATF,"The Financial Action Task Force (on Money Laundering) (FATF), also known by its French name, Groupe d'action financière (GAFI), is an intergovernmental organisation founded in 1989 on the initiative of the G7 to develop policies to combat money laundering. In 2001, its mandate was expanded to include terrorism financing.
The objectives of FATF are to set standards and promote effective implementation of legal, regulatory and operational measures for combating money laundering, terrorist financing and other related threats to the integrity of the international financial system. FATF is a ""policy-making body"" that works to generate the necessary political will to bring about national legislative and regulatory reforms in these areas. FATF monitors progress in implementing its Recommendations through ""peer reviews"" (""mutual evaluations"") of member countries.
Since 2000, FATF has maintained the FATF blacklist (formally called the ""Call for action"") and the FATF greylist (formally called the ""Other monitored jurisdictions""). The blacklist has led financial institutions to shift resources and services away from the listed. This in turn has motivated domestic economic and political actors in the listed countries to pressure their governments to introduce regulations that are compliant with the FATF.","[{'match': 'money', 'norm': 'money', 'case': 'lower', 'exact': True, 'start': 239, 'end': 244}, {'match': 'money', 'norm': 'money', 'case': 'lower', 'exact': True, 'start': 464, 'end': 469}, {'match': 'financial', 'norm': 'financial', 'case': 'lower', 'exact': True, 'start': 566, 'end': 575}, {'match': 'financial', 'norm': 'financial', 'case': 'lower', 'exact': True, 'start': 1058, 'end': 1067}]",True,policy,"{'policy': 0.9388455152511597, 'regulatory body': 0.6386851072311401, 'guideline': 0.5574721097946167, 'bank': 0.3854680061340332}"
14,14,ASIC,"An application-specific integrated circuit (ASIC ) is an integrated circuit (IC) chip customized for a particular use, rather than intended for general-purpose use. For example, a chip designed to run in a digital voice recorder or a high-efficiency video codec (e.g. AMD VCE) is an ASIC. Application-specific standard product (ASSP) chips are intermediate between ASICs and industry standard integrated circuits like the 7400 series or the 4000 series. ASIC chips are typically fabricated using metal-oxide-semiconductor (MOS) technology, as MOS integrated circuit chips.As feature sizes have shrunk and design tools improved over the years, the maximum complexity (and hence functionality) possible in an ASIC has grown from 5,000 logic gates to over 100 million. Modern ASICs often include entire microprocessors, memory blocks including ROM, RAM, EEPROM, flash memory and other large building blocks. Such an ASIC is often termed a SoC (system-on-chip). Designers of digital ASICs often use a hardware description language (HDL), such as Verilog or VHDL, to describe the functionality of ASICs.Field-programmable gate arrays (FPGA) are the modern-day technology improvement on breadboards, meaning that they are not made to be application-specific as opposed to ASICs. Programmable logic blocks and programmable interconnects allow the same FPGA to be used in many different applications. For smaller designs or lower production volumes, FPGAs may be more cost-effective than an ASIC design, even in production. The non-recurring engineering (NRE) cost of an ASIC can run into the millions of dollars. Therefore, device manufacturers typically prefer FPGAs for prototyping and devices with low production volume and ASICs for very large production volumes where NRE costs can be amortized across many devices.","[{'match': 'standard', 'norm': 'standard', 'case': 'lower', 'exact': True, 'start': 310, 'end': 318}, {'match': 'standard', 'norm': 'standard', 'case': 'lower', 'exact': True, 'start': 384, 'end': 392}]",True,Non-Financial Entity,"{'guideline': 0.2505337595939636, 'regulatory body': 0.19311730563640594, 'policy': 0.11921346187591553, 'bank': 0.0643296092748642, 'finance': 0.03640025854110718}"
20,20,EBA,The European Banking Authority (EBA) is a regulatory agency of the European Union headquartered in Paris. Its activities include conducting stress tests on European banks to increase transparency in the European financial system and identifying weaknesses in banks' capital structures.The EBA has the power to overrule national regulators if they fail to properly regulate their banks. The EBA is able to prevent regulatory arbitrage and should allow banks to compete fairly throughout the EU. The EBA will prevent a race to the bottom because banks established in jurisdictions with less regulation will no longer be at a competitive advantage compared to banks based in jurisdictions with more regulations as all banks will henceforth have to comply with the higher pan European standard.,"[{'match': 'financial', 'norm': 'financial', 'case': 'lower', 'exact': True, 'start': 212, 'end': 221}, {'match': 'standard', 'norm': 'standard', 'case': 'lower', 'exact': True, 'start': 781, 'end': 789}]",True,regulatory body,"{'regulatory body': 0.9875544905662537, 'bank': 0.8868182897567749, 'policy': 0.677623450756073, 'guideline': 0.5644438862800598}"
21,21,ECB,"The European Central Bank (ECB) is the prime component of the Eurosystem and the European System of Central Banks (ESCB) as well as one of seven institutions of the European Union. It is one of the world's most important central banks.
The ECB Governing Council makes monetary policy for the Eurozone and the European Union, administers the foreign exchange reserves of EU member states, engages in foreign exchange operations, and defines the intermediate monetary objectives and key interest rate of the EU. The ECB Executive Board enforces the policies and decisions of the Governing Council, and may direct the national central banks when doing so. The ECB has the exclusive right to authorise the issuance of euro banknotes. Member states can issue euro coins, but the volume must be approved by the ECB beforehand. The bank also operates the TARGET2 payments system.
The ECB was established by the Treaty of Amsterdam in May 1999 with the purpose of guaranteeing and maintaining price stability. On 1 December 2009, the Treaty of Lisbon became effective and the bank gained the official status of an EU institution. When the ECB was created, it covered a Eurozone of eleven members. Since then, Greece joined in January 2001, Slovenia in January 2007, Cyprus and Malta in January 2008, Slovakia in January 2009, Estonia in January 2011, Latvia in January 2014 and Lithuania in January 2015. The current President of the ECB is Christine Lagarde. Headquartered in Frankfurt, Germany, the bank formerly occupied the Eurotower prior to the construction of its new seat.
The ECB is directly governed by European Union law. Its capital stock, worth €11 billion, is owned by all 27 central banks of the EU member states as shareholders. The initial capital allocation key was determined in 1998 on the basis of the states' population and GDP, but the capital key has been readjusted since. Shares in the ECB are not transferable and cannot be used as collateral.","[{'match': 'bank', 'norm': 'bank', 'case': 'lower', 'exact': True, 'start': 825, 'end': 829}, {'match': 'bank', 'norm': 'bank', 'case': 'lower', 'exact': True, 'start': 1068, 'end': 1072}, {'match': 'bank', 'norm': 'bank', 'case': 'lower', 'exact': True, 'start': 1493, 'end': 1497}]",True,regulatory body,"{'regulatory body': 0.9070273637771606, 'policy': 0.8686766624450684, 'bank': 0.8483684062957764, 'guideline': 0.48082083463668823}"
30,30,QFC,"The Qatar Financial Centre (‘QFC’) is an onshore business and financial centre located in Doha, Qatar, providing legal and regulatory services for local and international companies.
The platform was established in March 2005. In June 2015, Yousuf Mohamed Al-Jaida, was appointed the Board Member and Chief Executive Officer of the QFC.
Registered entities gain access to QFC’s own legal, regulatory, tax and business environment, set up to contribute to Qatar’s national diversification and development plans. The QFC welcomes a broad range of financial and non-financial services, that support the development of Qatar and the wider region, and currently has over 1,400 firms registered on its platform.","[{'match': 'financial', 'norm': 'financial', 'case': 'lower', 'exact': True, 'start': 62, 'end': 71}, {'match': 'financial', 'norm': 'financial', 'case': 'lower', 'exact': True, 'start': 544, 'end': 553}, {'match': 'financial', 'norm': 'financial', 'case': 'lower', 'exact': True, 'start': 562, 'end': 571}]",True,regulatory body,"{'regulatory body': 0.8926263451576233, 'guideline': 0.8204950094223022, 'policy': 0.5479583144187927, 'bank': 0.3308854401111603}"
31,31,APRA,"APRA AMCOS consists of Australasian Performing Right Association (APRA) and Australasian Mechanical Copyright Owners Society (AMCOS), both copyright management organisations or copyright collectives which jointly represent over 100,000 songwriters, composers and music publishers in Australia and New Zealand. The two organisations work together to license public performances and administer performance, communication and reproduction rights on behalf of their members, who are creators of musical works, aiming to ensure fair payments to members and to defend their rights under the Australian Copyright Act (1968).
APRA, which formed in 1926, represents songwriters, composers, and music publishers, providing businesses with a range of licences to use copyrighted music. This covers music that is communicated or performed publicly including on radio, television, online, live gigs in pubs and clubs etc. APRA distributes the royalties from these licence fees back to their composer, songwriter and music publisher members and overseas affiliates.
AMCOS, which formed in 1979, is responsible for licensing musical works to third parties who reproduce music via CD, DVD, vinyl recording, downloading, streaming or other digital means of reproduction, issuing what are known as mechanical rights and distributing mechanical royalties to writers and publishers of music and overseas affiliates.
In 1997 the two societies formed an alliance; since then, APRA has managed the day-to-day operations of the AMCOS business, but each has its own board of directors, elected from and by their own membership. They jointly present the APRA Awards each year.","[{'match': 'board', 'norm': 'board', 'case': 'lower', 'exact': True, 'start': 1541, 'end': 1546}]",True,Non-Financial Entity,"{'regulatory body': 0.9499227404594421, 'guideline': 0.49194440245628357, 'policy': 0.39742499589920044, 'finance': 0.28027066588401794, 'bank': 0.06666179746389389}"
40,40,SEBI,"The Securities and Exchange Board of India (SEBI) is the regulatory body for securities and commodity market in India under the ownership of Ministry of Finance ,  Government of India. It was established on 12 April 1988 as an executive body and was given statutory powers on 30 January 1992 through the SEBI Act, 1992.

","[{'match': 'securities', 'norm': 'securities', 'case': 'lower', 'exact': True, 'start': 77, 'end': 87}]",True,regulatory body,"{'regulatory body': 0.9769091010093689, 'guideline': 0.3702305555343628, 'policy': 0.270222008228302, 'bank': 0.1441301703453064}"
41,41,IOSCO,"The International Organization of Securities Commissions (IOSCO) is an association of organizations that regulate the world's securities and futures markets. Members are typically primary securities and/or futures regulators in a national jurisdiction or the main financial regulator from each country. Its mandate is to:
Develop, implement, and promote high standards of regulation to enhance investor protection and reduce systemic risk
Share information with exchanges and assist them with technical and operational issues
Establish standards toward monitoring global investment transactions across borders and marketsIOSCO has members from over 100 countries, who regulate more than 95% of the world's securities markets. It has a permanent secretariat in Madrid, Spain.

","[{'match': 'securities', 'norm': 'securities', 'case': 'lower', 'exact': True, 'start': 126, 'end': 136}, {'match': 'securities', 'norm': 'securities', 'case': 'lower', 'exact': True, 'start': 188, 'end': 198}, {'match': 'financial', 'norm': 'financial', 'case': 'lower', 'exact': True, 'start': 264, 'end': 273}, {'match': 'securities', 'norm': 'securities', 'case': 'lower', 'exact': True, 'start': 706, 'end': 716}]",True,regulatory body,"{'regulatory body': 0.9768643379211426, 'guideline': 0.5327991843223572, 'policy': 0.5270076394081116, 'bank': 0.1771116703748703}"
42,42,CFR,"Fotbal Club CFR 1907 Cluj, commonly known as CFR Cluj (Romanian pronunciation: [t͡ʃefeˌre ˈkluʒ] or [ˌt͡ʃefere ˈkluʒ]), is a Romanian professional football club based in the city of Cluj-Napoca, Cluj County, which competes in the Liga I. It was founded in 1907 as Kolozsvári Vasutas Sport Club, when Transylvania was part of Austria-Hungary, and the current name CFR is the acronym for Căile Ferate Române (i.e. ""Romanian Railways"").
Before its latest promotion to the Liga I in 2004, the club had spent most of its existence in the lower divisions. CFR Cluj has since relied increasingly on foreign players for its success, and in the 2005–06 season participated in its first European competition, the Intertoto Cup, where it finished as runner-up. With significant financial support from previous owner Árpád Pászkány, CFR took the national title away from capital-based teams after seventeen years and became national champion for the first time in the 2007–08 campaign.Between 2017 and 2022, ""the White and Burgundies"" won five successive championships. In total, CFR has amassed sixteen domestic trophies, all of them in the 21st century—eight Liga I, four Cupa României, and four Supercupa României. As well as becoming an esteemed figure in Romanian football, the team has secured three qualifications each to the UEFA Champions League and Europa League group stages, and one qualification to the Europa Conference League group stage. 
CFR has a fierce rivalry with neighbouring Universitatea Cluj, with matches between the two being known as Derbiul Clujului. Several, but minor rivalries also developed in the recent period against teams with which CFR contended for the league title.

","[{'match': 'financial', 'norm': 'financial', 'case': 'lower', 'exact': True, 'start': 767, 'end': 776}]",True,regulatory body,"{'regulatory body': 0.7352925539016724, 'guideline': 0.4805380702018738, 'policy': 0.3231731057167053, 'bank': 0.311460018157959}"
43,43,FCA,"Fiat Chrysler Automobiles N.V. (FCA) was an Italian-American multinational corporation primarily known as a manufacturer of automobiles, commercial vehicles, auto parts and production systems. The Italian holding company Exor was the largest shareholder and owner of voting rights. At the time it was the world's eighth largest automobile maker. The group was established in October 2014 through the merger of Chrysler Group and Fiat S.p.A. Its corporate headquarters were domiciled in Amsterdam and its financial headquarters were in London. The holding company was listed on the New York Stock Exchange and Milan's Borsa Italiana. Exor, an Italian investment group controlled by the Agnelli family, owned 29.19% of FCA and controlled 44.31% through a loyalty voting mechanism.FCA's mass-market brands operated through two main subsidiaries: FCA Italy (previously Fiat Group Automobiles SpA) with headquarters in Turin, and FCA US (previously Chrysler Group LLC) in Auburn Hills, Michigan. The company's portfolio included brands Abarth, Alfa Romeo, Chrysler, Dodge, Fiat, Fiat Professional, Jeep, Lancia, Maserati, and Ram Trucks. Ferrari was spun off in 2016. FCA operated in four global markets (NAFTA, LATAM, APAC, EMEA).On 31 October 2019, FCA announced its intention to merge with the PSA Group (owner of the Peugeot and Citroën brands among others) on a 50-50 all-stock basis. On 18 December 2019, FCA and PSA announced that they had agreed to the terms of a binding $50 billion merger. In July 2020, the company announced its new name, Stellantis. On 16 January 2021, after FCA and PSA both having approved the merger on 4 January of the same year, the merger was complete with FCA resulted as a surviving entity and changed its name to Stellantis.
FCA also owned industrial subsidiaries Comau, Teksid, and Mopar.","[{'match': 'financial', 'norm': 'financial', 'case': 'lower', 'exact': True, 'start': 504, 'end': 513}]",True,regulatory body,"{'regulatory body': 0.5947849750518799, 'guideline': 0.30126962065696716, 'policy': 0.2030733972787857, 'bank': 0.05402890220284462}"
58,58,CBB,"Celebrity Big Brother 20 was the twentieth series of the British reality television series Celebrity Big Brother, hosted by Emma Willis and narrated by Marcus Bentley. The series launched on 1 August 2017, and  concluded on 25 August 2017 after 25 days, making this the shortest series since Celebrity Big Brother 12 in 2013. The series was on Channel 5 in the United Kingdom and 3e in Ireland with the spin-off show Celebrity Big Brother's Bit on the Side presented by Rylan Clark-Neal. It was the thirteenth celebrity series and twentieth series of Big Brother overall to air on Channel 5.
During the launch show on 1 August 2017, Willis confirmed that the winner would receive £50,000 for a charity of their choice. This is the first celebrity series to include a prize fund since Celebrity Big Brother 3 in 2005.On 25 August 2017, Sarah Harding was announced as the winner of the series having received 35.33% of the final vote, with Amelia Lily as the runner-up after receiving 29.92%.","[{'match': 'fund', 'norm': 'fund', 'case': 'lower', 'exact': True, 'start': 773, 'end': 777}]",True,guideline,"{'guideline': 0.7442991137504578, 'regulatory body': 0.7357385754585266, 'policy': 0.7022190690040588, 'bank': 0.6319712996482849}"
61,61,DFSA,"The Dubai Financial Services Authority (DFSA) is the financial regulatory agency of the special economic zone, the Dubai International Financial Centre (DIFC), In Dubai, United Arab Emirates. It is distinct from the UAE's federal Securities and Commodities Authority, whose jurisdiction covers the wider UAE outside the boundaries of the DIFC. It operates only within the special economic zone and is tasked with providing a regulatory environment of international standards.
The DFSA's regulatory mandate includes asset management, banking and credit services, securities, collective investment funds, custody and trust services, commodities futures trading, Islamic finance, insurance, an international equities exchange, and an international commodities derivatives exchange. In addition to regulating financial and ancillary services, the DFSA is responsible for supervising and enforcing anti-money laundering (AML) and counter-terrorist financing (CTF) requirements applicable in the DIFC. The DFSA has also accepted a delegation of powers from the DIFC Registrar of Companies (RoC) to investigate the affairs of DIFC companies and partnerships where a material breach of DIFC Companies Law is suspected and to pursue enforcement remedies available to the Registrar.","[{'match': 'financial', 'norm': 'financial', 'case': 'lower', 'exact': True, 'start': 53, 'end': 62}, {'match': 'securities', 'norm': 'securities', 'case': 'lower', 'exact': True, 'start': 562, 'end': 572}, {'match': 'finance', 'norm': 'finance', 'case': 'lower', 'exact': True, 'start': 668, 'end': 675}, {'match': 'financial', 'norm': 'financial', 'case': 'lower', 'exact': True, 'start': 805, 'end': 814}, {'match': 'money', 'norm': 'money', 'case': 'lower', 'exact': True, 'start': 898, 'end': 903}]",True,regulatory body,"{'regulatory body': 0.9860739707946777, 'guideline': 0.7583610415458679, 'bank': 0.741503119468689, 'policy': 0.49940231442451477}"
62,62,AIFC,"Audio Interchange File Format (AIFF) is an audio file format standard used for storing sound data for personal computers and other electronic audio devices. The format was developed by Apple Inc. in 1988 based on Electronic Arts' Interchange File Format (IFF, widely used on Amiga systems) and is most commonly used on Apple Macintosh computer systems.
The audio data in most AIFF files is uncompressed pulse-code modulation (PCM). This type of AIFF file uses much more disk space than lossy formats like MP3—about 10 MB for one minute of stereo audio at a sample rate of 44.1 kHz and a bit depth of 16 bits. There is also a compressed variant of AIFF known as AIFF-C or AIFC, with various defined compression codecs.
In addition to audio data, AIFF can include loop point data and the musical note of a sample, for use by hardware samplers and musical applications.
The file extension for the standard AIFF format is .aiff or .aif. For the compressed variants it is supposed to be .aifc, but .aiff or .aif are accepted as well by audio applications supporting the format.","[{'match': 'standard', 'norm': 'standard', 'case': 'lower', 'exact': True, 'start': 61, 'end': 69}, {'match': 'standard', 'norm': 'standard', 'case': 'lower', 'exact': True, 'start': 894, 'end': 902}]",True,Non-Financial Entity,"{'guideline': 0.8341653347015381, 'policy': 0.7908912301063538, 'bank': 0.5584755539894104, 'regulatory body': 0.5465116500854492, 'finance': 0.32314741611480713}"
